{
  "id": "level-11",
  "name": "The Furnace Gate",
  "zone": 3,
  "background": "furnace",
  "music": "bgm_zone3",
  "scrollSpeed": 12,
  "hpMultiplier": 2.1,
  "economy": {
    "startingScrap": 170,
    "trickle": 2.5
  },
  "waves": [
    {
      "time": 3,
      "enemyId": "rustcrawler",
      "count": 6,
      "interval": 0.9
    },
    {
      "time": 14,
      "enemyId": "incinerator_tank",
      "count": 1,
      "interval": 1,
      "lane": 1
    },
    {
      "time": 24,
      "enemyId": "burrower",
      "count": 3,
      "interval": 1.5
    },
    {
      "time": 36,
      "enemyId": "incinerator_tank",
      "count": 2,
      "interval": 6,
      "lane": 0
    },
    {
      "time": 46,
      "enemyId": "burrower",
      "count": 5,
      "interval": 1.2
    },
    {
      "time": 58,
      "enemyId": "incinerator_tank",
      "count": 2,
      "interval": 5,
      "lane": 2
    },
    {
      "time": 68,
      "enemyId": "burrower",
      "count": 6,
      "interval": 1,
      "hpMultiplier": 1.1
    }
  ],
  "stars": {
    "hullThreshold": 0.55
  },
  "rewards": {
    "firstClearCores": 30,
    "coresPerStar": 6
  }
}
