{
  "id": "level-06",
  "name": "Watchers on the Rim",
  "zone": 2,
  "background": "ash_canyons",
  "music": "bgm_zone2",
  "scrollSpeed": 13,
  "hpMultiplier": 1.45,
  "economy": {
    "startingScrap": 120,
    "trickle": 2
  },
  "waves": [
    {
      "time": 3,
      "enemyId": "rustcrawler",
      "count": 5,
      "interval": 1
    },
    {
      "time": 14,
      "enemyId": "gunner_walker",
      "count": 1,
      "interval": 1,
      "lane": 1
    },
    {
      "time": 24,
      "enemyId": "rustcrawler",
      "count": 6,
      "interval": 0.8
    },
    {
      "time": 34,
      "enemyId": "gunner_walker",
      "count": 2,
      "interval": 6,
      "lane": 0
    },
    {
      "time": 46,
      "enemyId": "scavenger_bike",
      "count": 5,
      "interval": 0.7,
      "lane": 2
    },
    {
      "time": 58,
      "enemyId": "gunner_walker",
      "count": 3,
      "interval": 5
    },
    {
      "time": 64,
      "enemyId": "rustcrawler",
      "count": 8,
      "interval": 0.6
    }
  ],
  "stars": {
    "hullThreshold": 0.6
  },
  "rewards": {
    "firstClearCores": 20,
    "coresPerStar": 5
  }
}
